{
  "slug": "zz-demo-research",
  "mode": "research",
  "example": true,
  "title": "Melatonin for adult sleep onset",
  "question": "Does melatonin improve sleep-onset latency in healthy adults, and is it safe short-term?",
  "sub_questions": [
    { "id": "efficacy", "text": "Does melatonin reduce sleep-onset latency in healthy adults?" },
    { "id": "dose", "text": "What dose and timing are most effective?" },
    { "id": "safety", "text": "Is short-term melatonin use safe in healthy adults?" }
  ],
  "scope": { "recency": "prefer sources < 10 years old", "source_types": ["meta-analysis", "trial", "guideline"] }
}
